{
  "schema_version": "m1",
  "node_id": "execute-1",
  "workflow_revision_id": "workflow-rev-approval-001",
  "artifact_lifecycle_state": "validated",
  "requested_tools": [
    {
      "tool_name": "local-file-writer",
      "access_mode": "write"
    }
  ],
  "requested_connectors": [
    {
      "connector_name": "fixture-catalog",
      "scope": "read:fixtures/approval-required"
    }
  ],
  "requested_permissions": [
    {
      "permission": "write",
      "target": "runs/approval-required-workflow"
    }
  ]
}
